JobTitle,Company,Location,PostDate,ExtractDate,Summary,Salary,JobUrl
Senior Member of Technical Staff,Athenahealth,"Chennai, Tamil Nadu",NOT MENTIONED,2025-09-28,NOT MENTIONED,NOT MENTIONED,NOT MENTIONED
Python Developer,rccenterprises,"Sholinganallur, Chennai, Tamil Nadu",NOT MENTIONED,2025-09-28,NOT MENTIONED,NOT MENTIONED,NOT MENTIONED
Python Developer,Daesung Electric India,"Guindy, Chennai, Tamil Nadu",NOT MENTIONED,2025-09-28,NOT MENTIONED,NOT MENTIONED,NOT MENTIONED
Lead Member of Technical Staff – Lead AI/ML,Athenahealth,"Chennai, Tamil Nadu",NOT MENTIONED,2025-09-28,NOT MENTIONED,NOT MENTIONED,NOT MENTIONED
Python Developer,valleypoint technologies,"Nungambakkam High Road, Chennai, Tamil Nadu",NOT MENTIONED,2025-09-28,NOT MENTIONED,NOT MENTIONED,NOT MENTIONED
Senior AI/ML Engineer,Kinaxis Inc.,"Perungudi, Chennai, Tamil Nadu",NOT MENTIONED,2025-09-28,NOT MENTIONED,NOT MENTIONED,NOT MENTIONED
"Hiring Python, React & AI Enthusiasts",Intellion Technologies Pvt Ltd,"Medavakkam, Chennai, Tamil Nadu",NOT MENTIONED,2025-09-28,NOT MENTIONED,NOT MENTIONED,NOT MENTIONED
Backend Python Developer,Keel Info Solution,"Chennai G.P.O, Chennai, Tamil Nadu",NOT MENTIONED,2025-09-28,NOT MENTIONED,NOT MENTIONED,NOT MENTIONED
Python Developer,Rytsense Technologies Private Limited,"Chennai, Tamil Nadu",NOT MENTIONED,2025-09-28,NOT MENTIONED,NOT MENTIONED,NOT MENTIONED
Python Developer,Hyeongshin Automotive Industry,"Chennai, Tamil Nadu",NOT MENTIONED,2025-09-28,NOT MENTIONED,NOT MENTIONED,NOT MENTIONED
Python Developer,The Viswa Group,"Tambaram, Chennai, Tamil Nadu",NOT MENTIONED,2025-09-28,NOT MENTIONED,NOT MENTIONED,NOT MENTIONED
Junior Python Developer,MAXWELL Global Software,"Valasaravakkam, Chennai, Tamil Nadu",NOT MENTIONED,2025-09-28,NOT MENTIONED,NOT MENTIONED,NOT MENTIONED
junior software engineer,Quantra Technology Solutions Private Limited,"Chennai, Tamil Nadu",NOT MENTIONED,2025-09-28,NOT MENTIONED,NOT MENTIONED,NOT MENTIONED
Python developer,dv-indan,"Chennai, Tamil Nadu",NOT MENTIONED,2025-09-28,NOT MENTIONED,NOT MENTIONED,NOT MENTIONED
Python Developer,Qode,Hybrid work in Tamil Nadu,NOT MENTIONED,2025-09-28,NOT MENTIONED,NOT MENTIONED,NOT MENTIONED
Mernstack Developer with Python,myproject.ai,"Pattravakkam, Chennai, Tamil Nadu",NOT MENTIONED,2025-09-28,NOT MENTIONED,NOT MENTIONED,NOT MENTIONED
Python Full Stack Developer,MAXWELL Global Software,"Valasaravakkam, Chennai, Tamil Nadu",NOT MENTIONED,2025-09-28,NOT MENTIONED,NOT MENTIONED,NOT MENTIONED
Python Developer – AI & Data Science,Avaniko Technologies Private Limited,"Madipakkam, Chennai, Tamil Nadu",NOT MENTIONED,2025-09-28,NOT MENTIONED,NOT MENTIONED,NOT MENTIONED
Python/Django Developer,Adhanam Infotech Private Limited,"Guindy, Chennai, Tamil Nadu",NOT MENTIONED,2025-09-28,NOT MENTIONED,NOT MENTIONED,NOT MENTIONED
Jr. Python Developer,Aliqan Technologies,"Chennai, Tamil Nadu",NOT MENTIONED,2025-09-28,NOT MENTIONED,NOT MENTIONED,NOT MENTIONED
Python Developer,EWall Solutions,"Chennai, Tamil Nadu",NOT MENTIONED,2025-09-28,NOT MENTIONED,NOT MENTIONED,NOT MENTIONED
FULL STACK DEVELOPER (PYTHON & REACTJS),Kyvor Genomics Pvt Ltd.,"Chennai, Tamil Nadu",NOT MENTIONED,2025-09-28,NOT MENTIONED,NOT MENTIONED,NOT MENTIONED
Full Stack Developer,RTH Infotech Pvt Ltd,"Velachery, Chennai, Tamil Nadu",NOT MENTIONED,2025-09-28,NOT MENTIONED,NOT MENTIONED,NOT MENTIONED
Python AI/ML Developer,Warrior tech solutions,"Chennai, Tamil Nadu",NOT MENTIONED,2025-09-28,NOT MENTIONED,NOT MENTIONED,NOT MENTIONED
App / Website Developer (Freelancer),G-TEC COMPUTER EDUCATION,"Anna Nagar, Chennai, Tamil Nadu",NOT MENTIONED,2025-09-28,NOT MENTIONED,NOT MENTIONED,NOT MENTIONED
Software Developer,Ravel Electronics Pvt Ltd,"Perungudi, Chennai, Tamil Nadu",NOT MENTIONED,2025-09-28,NOT MENTIONED,NOT MENTIONED,NOT MENTIONED
Python Developer,Desirous Global Consulting,"Chennai, Tamil Nadu",NOT MENTIONED,2025-09-28,NOT MENTIONED,NOT MENTIONED,NOT MENTIONED
Python Developer,RCG Global Services,"Chennai, Tamil Nadu",NOT MENTIONED,2025-09-28,NOT MENTIONED,NOT MENTIONED,NOT MENTIONED
Python Full Stack Developer,Virtusa,"Hybrid work in Chennai, Tamil Nadu",NOT MENTIONED,2025-09-28,NOT MENTIONED,NOT MENTIONED,NOT MENTIONED
Web Developer,Nexode Tech Private Limited,"Chengalpattu, Chennai, Tamil Nadu",NOT MENTIONED,2025-09-28,NOT MENTIONED,NOT MENTIONED,NOT MENTIONED
